npid,startup_name,website,founder_name,founder_email,founder_telegram,founder_city,founder_country,house,current_progress,stealth,login_code,bio,motivation,traction,product,long_pitch,founder_linkedin_url,demo_video_url,one_pager_url,github_repos,problem_statement,customer,product_job_to_be_done,value_proposition,current_workaround,why_now_catalyst,key_differentiator,founder_time_commitment_pct,competitors_urls,Business_model_explained,circle,circle_name,circle_description,wave,nocap_motivation
6008,PromptCards,promptcards.co,Alice Becker,alice@promptcards.co,,Berlin,Germany,side,0.22,false,bG9naW46NjAwOA==,Printed decks of AI prompts.,Fun maker project.,1,Prompt decks,PromptCards turns prompt engineering into a tactile learning game for teams and classrooms. First print run sold to a workshop cohort; next: companion microsite with live examples. Margin from print + digital add‑ons. Edge: playful pedagogy that accelerates real‑world practice.,,,,,,,,,,,,,,,4,Creative & Content,"Content creators and community builders. Masters of audience engagement, viral growth, and creative monetization strategies.",wave1,"Fun concept Alice! Physical prompt cards make AI learning tangible and shareable. That first workshop sale validates the concept. Focus on building community around the cards - teachers and trainers will love materials that make complex topics approachable. Scale through educational channels."
6009,TinySaaS Studio,tinysaas.studio,Diego Mora,diego@tinysaas.studio,,Madrid,Spain,side,0.15,false,bG9naW46NjAwOQ==,Micro SaaS templates.,Learn to ship fast.,25,Templates,"Not every app needs VC. TinySaaS sells boilerplates and checklists that help makers launch $100 MRR products in a weekend. 25 early buyers; expanding into niche stacks (billing, auth, deploy). Revenue from template sales and updates. Edge: opinionated patterns optimized for speed to first dollar.",,,,,,,,,,,,,,,4,Creative & Content,"Content creators and community builders. Masters of audience engagement, viral growth, and creative monetization strategies.",wave1,"Great validation Diego! 25 early buyers shows real demand for shipping faster. Your focus on first dollar over VC is smart positioning. Build in public and share the success stories of makers who used your templates to hit $100 MRR - nothing sells better than proven results."
6010,OpenCare AI,opencare.ai,Priya Rao,priya@opencare.ai,,Bangalore,India,karma,0.31,false,bG9naW46NjAxMA==,Open-source health records assistant.,Healthcare access for all.,1,Health records assistant,Clinics in low‑resource settings lack triage and records tools that work offline. OpenCare AI provides lightweight assistants that run on low‑cost devices. One clinic pilot; model is open‑core with services. Edge: offline‑first design and local customization with privacy built‑in.,,,,,,,,,,,,,,,2,Impact & Social Good,"Mission-driven founders solving healthcare, education, and social challenges. Strong focus on measurable outcomes and sustainable impact.",wave1,"Important mission Priya! Healthcare access in low-resource settings is critical work. Your offline-first approach is essential for real-world deployment. Focus on documenting measurable outcomes from that first clinic - improved patient flow, better record keeping. Success stories will attract NGO and government support."
6011,TeachHub,teachhub.africa,Mark Evans,mark@teachhub.africa,,Nairobi,Kenya,karma,0.27,false,bG9naW46NjAxMQ==,AI teacher aide for rural schools.,Close education gaps.,3,Teacher aide,Rural teachers are overstretched. TeachHub provides lesson planning and SMS‑based support that works without broadband. 3 schools piloting; NGO/government channel. Low‑cost per‑teacher subscriptions. Edge: works on the edge—offline‑first workflow and measurable learning gains.,,,,,,,,,,,,,,,2,Impact & Social Good,"Mission-driven founders solving healthcare, education, and social challenges. Strong focus on measurable outcomes and sustainable impact.",wave1,"Vital work Mark! Rural education support is desperately needed. Your SMS-based approach is brilliant for connectivity constraints. Focus on measuring learning gains in those 3 pilot schools - concrete education outcomes will be powerful for NGO funding and government partnerships."
6012,GreenCity Map,greencitymap.org,Lina Chen,lina@greencitymap.org,,Shanghai,China,karma,0.24,false,bG9naW46NjAxMg==,Community map for urban green spaces.,Healthier cities.,2,Civic tech map,"Cities need more green but lack granular data. GreenCity Map crowdsources parks and trees, highlights underserved zones, and gives planners open data to act. 2 communities contributing; model: grants + civic partnerships. Edge: community activation playbook and open datasets that enable action.",,,,,,,,,,,,,,,2,Impact & Social Good,"Mission-driven founders solving healthcare, education, and social challenges. Strong focus on measurable outcomes and sustainable impact.",wave1,"Meaningful impact Lina! Urban green space data helps cities make better decisions. Your community activation approach is smart for sustainable data collection. Focus on showing measurable impact in those 2 pilot communities - green space improvements driven by your data will attract city government partnerships."